id,title,original_language,overview,release_date,original_title,vote_average,vote_count
10764,Quantum of Solace,en,"Betrayed by Vesper, the woman he loved, 007 fights the urge to make his latest mission personal. Pursuing his determination to uncover the truth, Bond and M interrogate Mr. White, who reveals that the organization that blackmailed Vesper is far more complex and dangerous than anyone had imagined.",2008-10-29,Quantum of Solace,6.337,8545
404368,Ralph Breaks the Internet,en,"Video game bad guy Ralph and fellow misfit Vanellope von Schweetz must risk it all by traveling to the World Wide Web in search of a replacement part to save Vanellope's video game, Sugar Rush. In way over their heads, Ralph and Vanellope rely on the citizens of the internet — the netizens — to help navigate their way, including an entrepreneur named Yesss, who is the head algorithm and the heart and soul of trend-making site BuzzzTube.",2018-11-20,Ralph Breaks the Internet,7.16,8101
513310,Boss Level,en,"A former special forces agent is trapped in a time loop and relives his death over and over again. To escape the terrible situation, he must track down those responsible and stop them.",2021-02-19,Boss Level,6.872,1921
1153714,Death of a Unicorn,en,"A father and daughter accidentally hit and kill a unicorn while en route to a weekend retreat, where his billionaire boss seeks to exploit the creature’s miraculous curative properties.",2025-03-17,Death of a Unicorn,6.396,818
924,Dawn of the Dead,en,"A group of survivors take refuge in a shopping mall after the world is taken over by aggressive, flesh-eating zombies.",2004-03-19,Dawn of the Dead,7.069,4503
1401778,Turbulence,en,"Young married couple Zach and Emmy decide to take a hot air balloon trip across the Italian Dolomites to rekindle their relationship. When they and pilot Harry are joined by a third passenger, Julia, events unfold in ways they could never imagine five thousand meters in the air.",2025-11-26,Turbulence,6.659,135
793387,Holy Night: Demon Hunters,ko,"When a devil-worshipping criminal network plunges Seoul into chaos, the police turn to Holy Night—a trio of supernatural demon hunters—to restore order and defeat the rising evil.",2025-04-30,거룩한 밤: 데몬 헌터스,6.877,102
1426776,STRAW,en,What will be her last straw? A devastatingly bad day pushes a hardworking single mother to the breaking point — and into a shocking act of desperation.,2025-06-05,STRAW,7.71,960
10030,Good Luck Chuck,en,"Cursed since childhood, dentist Charlie Logan cannot find the right woman. Even worse, he learns that each of his ex-girlfriends finds true love with the man she meets after her relationship with him ends. Hearing of Charlie's reputation as a good-luck charm, women from all over line up for a quick tryst. But when Charlie meets the woman of his dreams, he must find a way to break the curse or risk losing her to the next man she meets.",2007-09-21,Good Luck Chuck,5.932,1660
687209,Female Wars: The Man Who Moved In,ko,"Min-jeong lives a simple but happy life until it's in ruins because of the man that moves in next to her. The man is Deok-man, someone she wants to erase from her memories.  She knows what he's up to next and she plans to take revenge on him.",2016-10-17,여자 전쟁: 이사 온 남자,6.0,2
1381216,Gator Lake,en,"In 2003, Lake Jesup became the stage for a real-life horror story, as a monstrous alligator escaped from captivity and began a reign of terror. As the body count rose, a desperate hunt ensued to stop the creature.",2024-05-01,Gator Lake,6.367,49
134764,Due West: Our Sex Journey,cn,"Set in contemporary Hong Kong, several young people are searching for romance and struggling to learn the difference between lust and love in an adventure that takes them to the mainland where pleasure is much more readily available.",2012-09-20,一路向西,6.051,59
1545621,Detective Conan: Fallen Angel of the Highway,ja,"The 29th Detective Conan film will center on Chihaya Hagiwara, a member of the Kanagawa Prefectural Police and the leader of its motorcycle division.",2026-04-10,名探偵コナン ハイウェイの堕天使,8.6,9
435,The Day After Tomorrow,en,"After paleoclimatologist Jack Hall is largely ignored by UN officials when presenting his environmental concerns about the beginning of a new Ice Age, his research proves true when a superstorm develops, setting off catastrophic natural disasters throughout the world. Trying to get to his son, Sam, who is trapped in New York City with his friend Laura and others, Jack and his crew must travel to get to Sam before it's too late.",2004-05-26,The Day After Tomorrow,6.559,8875
2059,National Treasure,en,"Modern treasure hunters, led by archaeologist Ben Gates, search for a chest of riches rumored to have been stashed away by George Washington, Thomas Jefferson and Benjamin Franklin during the Revolutionary War. The chest's whereabouts may lie in secret clues embedded in the Constitution and the Declaration of Independence, and Gates is in a race to find the gold before his enemies do.",2004-11-19,National Treasure,6.651,6868
938,For a Few Dollars More,it,"Two bounty hunters both pursue the brutal and sadistic bandit, El Indio, who has a large bounty on his head.",1965-12-18,Per qualche dollaro in più,8.027,4465
960292,My Sole Desire,fr,"When aimless Manon begins work at À mon seul désir, a strip club that offers high concept performances, she instantly bonds with her fellow strippers, particularly Mia, an aspiring actress with a boyfriend and child. Manon learns that it is “not easy money, but fast money” and when she finds herself falling for Mia, she is forced to question her priorities as she explores her newfound erotic life.",2023-04-05,À mon seul désir,6.536,111
13811,Knowing,en,A teacher opens a time capsule that has been dug up at his son's elementary school; in it are some chilling predictions -- some that have already occurred and others that are about to -- that lead him to believe his family plays a role in the events that are about to unfold.,2009-03-19,Knowing,6.257,5816
1372,Blood Diamond,en,"An ex-mercenary turned smuggler. A Mende fisherman. Amid the explosive civil war overtaking 1999 Sierra Leone, these men join for two desperate missions: recovering a rare pink diamond of immense value and rescuing the fisherman's son, conscripted as a child soldier into the brutal rebel forces ripping a swath of torture and bloodshed countrywide.",2006-12-08,Blood Diamond,7.561,8332
300671,13 Hours: The Secret Soldiers of Benghazi,en,An American Ambassador is killed during an attack at a U.S. compound in Libya as a security team struggles to make sense out of the chaos.,2016-01-14,13 Hours: The Secret Soldiers of Benghazi,7.275,3948
451156,Infidelity in Suburbia,en,"With her husband away at work, and her son at school, Laura dreams of a home-renovation project to supplant her restless days. Elliott, her irresistibly hot private contractor, soon fulfills her more forbidden dreams.",2017-02-25,Infidelity in Suburbia,6.2,156
1163974,The Karma of Sex,zh,,1999-09-25,玉蒲团之极乐宝鉴,7.0,3
565,The Ring,en,Journalist Rachel Keller investigates a strange videotape that may be behind the untimely deaths of four teenagers. There is an urban legend about this tape: the viewer will die seven days after watching it. Rachel tracks down the video... and watches it. Now she has just seven days to unravel the mystery of the Ring in order to save herself and her son.,2002-10-18,The Ring,6.702,6679
1274675,Futon,ja,"Tokio Takenaka (48) is a scriptwriter who's lost his passion for his work, and whose relationship with his wife Madoka (37) has turned sour. He spends his days lost in a haze. One day, a girl named Yoshimi Yokoyama (21) barges into his office, saying that she's a huge fan of his work and aiming to be a scriptwriter herself. Overcome by her enthusiasm, he agrees to take her in. As they work together, he begins to sense her talent as a writer, and at the same time, comes to feel sexually attracted towards her. Soon he's writing scripts that he's proud of again, and begins to feel fulfilled in both his private and work lives. But it doesn't take long before he learns about her boyfriend and fellow scriptwriter Hideo Tanaka (20). He becomes madly jealous, but.",2024-05-11,蒲団,0.0,0
33,Unforgiven,en,"William Munny is a retired, once-ruthless killer turned gentle widower and hog farmer. To help support his two motherless children, he accepts one last bounty-hunter mission to find the men who brutalized a prostitute. Joined by his former partner and a cocky greenhorn, he takes on a corrupt sheriff.",1992-08-07,Unforgiven,7.91,4951
9802,The Rock,en,"When vengeful General Francis X. Hummel seizes control of Alcatraz Island and threatens to launch missiles loaded with deadly chemical weapons into San Francisco, only a young FBI chemical weapons expert and notorious Federal prisoner have the skills to penetrate the impregnable island fortress and take him down.",1996-06-07,The Rock,7.149,5191
76025,Shame,en,"Brandon, a thirty-something man living in New York, eludes intimacy with women but feeds his deepest desires with a compulsive addiction to sex. When his younger sister temporarily moves into his apartment, stirring up bitter memories of their shared painful past, Brandon's life, like his fragile mind, gets out of control.",2011-10-02,Shame,6.927,3410
1327862,Regretting You,en,"Morgan Grant and her daughter Clara explore what's left behind after a devastating accident reveals a shocking betrayal and forces them to confront family secrets, redefine love, and rediscover each other.",2025-10-22,Regretting You,7.022,411
1199193,Pose,en,"Isolated in a grand country manor, a reclusive artist spends a passionate and paranoid weekend with his ex-lover, an obsessive fan, and a potential muse. Hoping to spark a new wave of artistic brilliance over the course of a few tumultuous days, filled with chaos and revelation not all of them will make it out alive.",2026-02-25,Pose,6.3,33
1131759,Omniscient Reader: The Prophecy,ko,"Kim Dok-ja, an ordinary man in his 20s, is the only reader of an obscure web novel titled ""Three Ways to Survive the Apocalypse"". After having read the last chapter, the novel suddenly becomes reality, and its omnipotent hero Yu Jung-hyeok appears before Kim. As the only person who knows how to survive in this world, Kim and his companions strive to save the world by writing his own, new ending.",2025-07-23,전지적 독자 시점,6.891,92
581726,Infinite,en,"Evan McCauley has skills he never learned and memories of places he has never visited. Self-medicated and on the brink of a mental breakdown, a secret group that call themselves “Infinites” come to his rescue, revealing that his memories are real.",2021-09-09,Infinite,6.562,2143
936108,Smurfs,en,"When Papa Smurf is mysteriously taken by evil wizards, Razamel and Gargamel, Smurfette leads the Smurfs on a mission into the real world to save him. With the help of new friends, the Smurfs must discover what defines their destiny to save the universe.",2025-06-30,Smurfs,5.779,265
19908,Zombieland,en,"Columbus has made a habit of running from what scares him. Tallahassee doesn't have fears. If he did, he'd kick their ever-living ass. In a world overrun by zombies, these two are perfectly evolved survivors. But now, they're about to stare down the most terrifying prospect of all: each other.",2009-10-02,Zombieland,7.26,13171
13971,Wild Child,en,"Sixteen-year-old Poppy has everything her unlimited credit cards can buy, and a spoiled attitude to match. After a final thoughtless prank, her exasperated father ships her off to boarding school in England. There, Poppy meets her match in a stern headmistress and a class full of girls who will not tolerate her selfishness.",2008-08-15,Wild Child,6.7,1919
9738,Fantastic Four,en,"During a space voyage, four scientists are altered by cosmic rays: Reed Richards gains the ability to stretch his body; Sue Storm can become invisible; Johnny Storm controls fire; and Ben Grimm is turned into a super-strong … thing. Together, these ""Fantastic Four"" must now thwart the evil plans of Dr. Doom and save the world from certain destruction.",2005-06-29,Fantastic Four,5.809,9985
274857,King Arthur: Legend of the Sword,en,"When the child Arthur’s father is murdered, Vortigern, Arthur’s uncle, seizes the crown. Robbed of his birthright and with no idea who he truly is, Arthur comes up the hard way in the back alleys of the city. But once he pulls the sword Excalibur from the stone, his life is turned upside down and he is forced to acknowledge his true legacy... whether he likes it or not.",2017-05-10,King Arthur: Legend of the Sword,6.557,6057
872906,Jawan,hi,"An emotional journey of a prison warden, driven by a personal vendetta while keeping up to a promise made years ago, recruits inmates to commit outrageous crimes that shed light on corruption and injustice, in an attempt to get even with his past,  and that leads him to an unexpected reunion.",2023-09-07,जवान,7.077,326
1108427,Moana,en,"Moana answers the Ocean's call and, for the first time, voyages beyond the reef of her island of Motunui with the infamous demigod Maui on an unforgettable journey to restore prosperity to her people.",2026-07-08,Moana,0.0,0
6114,Bram Stoker's Dracula,en,"Count Dracula, a 15th-century prince, is condemned to live off the blood of the living for eternity. Young lawyer Jonathan Harker is sent to Dracula's castle to finalise a land deal, but when the Count sees a photo of Harker's fiancée, Mina, the spitting image of his dead wife, he imprisons him and sets off for London to track her down.",1992-11-13,Bram Stoker's Dracula,7.451,5768
824744,Shiddat,hi,"Love-struck Jaggi can cross the seven seas for his dream girl, Kartika. Even if it means stopping her wedding as he doesn't want to be friend-zoned.",2021-10-01,शिद्दत,6.681,36
7980,The Lovely Bones,en,"After being brutally murdered, 14-year-old Susie Salmon watches from heaven over her grief-stricken family -- and her killer. As she observes their daily lives, she must balance her thirst for revenge with her desire for her family to heal.",2009-12-26,The Lovely Bones,7.062,4950
1550797,Prep & Landing: The Snowball Protocol,en,"Christmas elves Lanny and Wayne panic when their holiday missions go awry, leaving Wayne thinking he's in BIG trouble with Santa and accidentally revealing other merry mishaps.",2025-11-27,Prep & Landing: The Snowball Protocol,7.047,32
315011,Shin Godzilla,ja,"When a massive, gilled monster emerges from the deep and tears through the city, the government scrambles to save its citizens.  A rag-tag team of volunteers cuts through a web of red tape to uncover the monster's weakness and its mysterious ties to a foreign superpower.  But time is not on their side - the greatest catastrophe to ever befall the world is about to evolve right before their very eyes.",2016-07-29,シン・ゴジラ,7.227,1565
324558,X-Rated: The Greatest Adult Movies of All Time,en,"The evolution of adult cinema through the most influential films in history, a journey that begins in the 1970s and ends nowadays. An in-depth analysis of the success of the most prestigious erotic films, their impact on industry and society, and their influence on cinema and contemporary culture.",2015-02-06,X-Rated: The Greatest Adult Movies of All Time,6.415,195
71676,Ghost Rider: Spirit of Vengeance,en,"When the devil resurfaces with aims to take over the world in human form, Johnny Blaze reluctantly comes out of hiding to transform into the flame-spewing supernatural hero Ghost Rider -- and rescue a 10-year-old boy from an unsavory end.",2011-12-10,Ghost Rider: Spirit of Vengeance,5.0,4067
254128,San Andreas,en,"In the aftermath of a massive earthquake in California, a rescue-chopper pilot makes a dangerous journey across the state in order to rescue his estranged daughter.",2015-05-27,San Andreas,6.247,9017
997265,Rule 34,pt,"Simone is a young law student who studies criminal law and advocates for women's rights. On her free time, she's a cam girl that makes live sexual performances on the Internet. One night, she watches a video that awakens her interest in BDSM-related activities, leading her into a series of conflicts dominated by violence and eroticism.",2023-01-19,Regra 34,5.3,21
264660,Ex Machina,en,"Caleb, a coder at the world's largest internet company, wins a competition to spend a week at a private mountain retreat belonging to Nathan, the reclusive CEO of the company. But when Caleb arrives at the remote location he finds that he will have to participate in a strange and fascinating experiment in which he must interact with the world's first true artificial intelligence, housed in the body of a beautiful robot girl.",2015-01-21,Ex Machina,7.573,14261
2034,Training Day,en,"On his first day on the job as a narcotics officer, a rookie cop works with a rogue detective who isn't what he appears.",2001-10-05,Training Day,7.521,6605
1422227,Aşk Sadece Bir An,tr,A young man and woman from very different backgrounds fall in love but their relationship faces obstacles from his troubled past and her overprotective parents.,2025-02-14,Aşk Sadece Bir An,6.6,12
2288,Closer,en,The relationships of two couples become complicated and deceitful when the man from one couple meets the woman of the other.,2004-12-03,Closer,6.834,3742
360920,The Grinch,en,The Grinch hatches a scheme to ruin Christmas when the residents of Whoville plan their annual holiday celebration. But a certain little who might change things.,2018-11-08,The Grinch,6.866,4434
280092,Insidious: Chapter 3,en,"A twisted new tale of terror begins for a teenage girl and her family, and revealing more mysteries of the otherworldly realm, 'The Further'.",2015-05-28,Insidious: Chapter 3,6.283,3610
762441,A Quiet Place: Day One,en,"As New York City is invaded by alien creatures who hunt by sound, a woman named Sam fights to survive with her cat.",2024-06-26,A Quiet Place: Day One,6.645,3351
296,Terminator 3: Rise of the Machines,en,"It's been 10 years since John Connor saved Earth from Judgment Day, and he's now living under the radar, steering clear of using anything Skynet can trace. That is, until he encounters T-X, a robotic assassin ordered to finish what T-1000 started. Good thing Connor's former nemesis, the Terminator, is back to aid the now-adult Connor … just like he promised.",2003-07-02,Terminator 3: Rise of the Machines,6.194,7257
296,Terminator 3: Rise of the Machines,en,"It's been 10 years since John Connor saved Earth from Judgment Day, and he's now living under the radar, steering clear of using anything Skynet can trace. That is, until he encounters T-X, a robotic assassin ordered to finish what T-1000 started. Good thing Connor's former nemesis, the Terminator, is back to aid the now-adult Connor … just like he promised.",2003-07-02,Terminator 3: Rise of the Machines,6.194,7257
758330,"Good Luck to You, Leo Grande",en,"Nancy Stokes, a retired schoolteacher, is pretty sure she has never had good sex. Now that her husband has died, she is determined to take a tour of sexual vistas that until now she has only imagined. She even has a plan; it involves an anonymous hotel room, and a sex worker who calls himself Leo Grande.",2022-06-16,"Good Luck to You, Leo Grande",6.977,673
193756,Lone Survivor,en,"Four Navy SEALs on a covert mission to neutralize a high-level Taliban operative must make an impossible moral decision in the mountains of Afghanistan that leads them into an enemy ambush. As they confront unthinkable odds, the SEALs must find reserves of strength and resilience to fight to the finish.",2013-12-24,Lone Survivor,7.432,4749
22794,Cloudy with a Chance of Meatballs,en,"Inventor Flint Lockwood creates a machine that makes clouds rain food, enabling the down-and-out citizens of Chewandswallow to feed themselves. But when the falling food reaches gargantuan proportions, Flint must scramble to avert disaster. Can he regain control of the machine and put an end to the wild weather before the town is destroyed?",2009-09-17,Cloudy with a Chance of Meatballs,6.658,6446
9426,The Fly,en,"When brilliant, eccentric scientist Seth Brundle makes a huge technological breakthrough in teleportation, he decides to test it on himself. Unbeknownst to him, a common housefly manages to get inside the device and the two become one.",1986-08-15,The Fly,7.433,4964
614930,Teenage Mutant Ninja Turtles: Mutant Mayhem,en,"After years of being sheltered from the human world, the Turtle brothers set out to win the hearts of New Yorkers and be accepted as normal teenagers through heroic acts. Their new friend April O'Neil helps them take on a mysterious crime syndicate, but they soon get in over their heads when an army of mutants is unleashed upon them.",2023-07-31,Teenage Mutant Ninja Turtles: Mutant Mayhem,7.2,1594
495764,Birds of Prey (and the Fantabulous Emancipation of One Harley Quinn),en,"Harley Quinn joins forces with a singer, an assassin and a police detective to help a young girl who had a hit placed on her after she stole a rare diamond from a crime lord.",2020-02-05,Birds of Prey (and the Fantabulous Emancipation of One Harley Quinn),6.878,10813
398978,The Irishman,en,"Pennsylvania, 1956. Frank Sheeran, a war veteran of Irish origin who works as a truck driver, accidentally meets mobster Russell Bufalino. Once Frank becomes his trusted man, Bufalino sends him to Chicago with the task of helping Jimmy Hoffa, a powerful union leader related to organized crime, with whom Frank will maintain a close friendship for nearly twenty years.",2019-11-01,The Irishman,7.576,7514
91586,Insidious: Chapter 2,en,The haunted Lambert family seeks to uncover the mysterious childhood secret that has left them dangerously connected to the spirit world.,2013-09-12,Insidious: Chapter 2,6.681,4568
1241983,Train Dreams,en,A logger leads a life of quiet grace as he experiences love and loss during an era of monumental change in early 20th-century America.,2025-11-05,Train Dreams,7.311,1001
5528,The Chorus,fr,"In 1940s France, a new teacher at a school for disruptive boys gives hope and inspiration.",2004-03-17,Les Choristes,7.74,2612
17654,District 9,en,"Thirty years ago, aliens arrive on Earth. Not to conquer or give aid, but to find refuge from their dying planet. Separated from humans in a South African area called District 9, the aliens are managed by Multi-National United, which is unconcerned with the aliens' welfare but will do anything to master their advanced technology. When a company field agent contracts a mysterious virus that begins to alter his DNA, there is only one place he can hide: District 9.",2009-08-05,District 9,7.467,10343
776503,CODA,en,"As a CODA (Child of Deaf Adults), Ruby is the only hearing person in her deaf family. When the family's fishing business is threatened, Ruby finds herself torn between pursuing her love of music and her fear of abandoning her parents.",2021-08-13,CODA,7.889,2584
1288445,Mutiny,en,"After witnessing his billionaire boss' murder and being framed for the crime, Cole Reed boards a cargo ship on a one-man crusade to avenge his boss' death only to discover an international conspiracy.",2026-08-19,Mutiny,0.0,0
938150,Wardriver,en,"He’s a Wardriver: a hacker who steals from banks, not people—until he’s noticed. Now the money turns violent, and the woman caught in it could save him or kill them both.",2026-03-04,Wardriver,6.966,59
11690,Bloodsport,en,An American Army Major goes AWOL to Hong Kong for an outlawed martial arts contest called the Kumite.,1988-02-26,Bloodsport,7.048,2162
1376484,Roid,bn,"A solitary middle aged man marries a madwoman and builds a house on a vacant plot of land far from the village. However, his wife’s madness becomes a calamity in his tranquil life.",2026-05-28,রইদ,0.0,0
375834,"It's Called 'Murder', Baby",en,"In 1940s Los Angeles, private investigator Nick Popodopolis, is hired by actress Dixie Ray, to find her blackmailer.  Edited R version of adult film, Dixie Ray Hollywood Star.",1983-06-15,"It's Called 'Murder', Baby",7.0,5
220289,Coherence,en,Four couples gather for dinner the night a mysterious and powerful comet passes overhead.,2014-04-06,Coherence,7.213,3410
500664,Upgrade,en,"A brutal mugging leaves Grey Trace paralyzed in the hospital and his beloved wife dead. A billionaire inventor soon offers Trace a cure — an artificial intelligence implant called STEM that will enhance his body. Now able to walk, Grey finds that he also has superhuman strength and agility — skills he uses to seek revenge against the thugs who destroyed his life.",2018-05-31,Upgrade,7.505,5014
300668,Annihilation,en,"A biologist signs up for a dangerous, secret expedition into a mysterious zone where the laws of nature don't apply.",2018-02-22,Annihilation,6.44,9362
763215,Damsel,en,A young woman's marriage to a charming prince turns into a fierce fight for survival when she's offered up as a sacrifice to a fire-breathing dragon.,2024-03-07,Damsel,6.982,2786
787699,Wonka,en,"Willy Wonka – chock-full of ideas and determined to change the world one delectable bite at a time – is proof that the best things in life begin with a dream, and if you’re lucky enough to meet Willy Wonka, anything is possible.",2023-12-06,Wonka,7.039,4388
