id,title,original_language,overview,release_date,original_title,vote_average,vote_count
1339713,Obsession,en,"After breaking the mysterious ""One Wish Willow"" to win his crush's heart, a hopeless romantic finds himself getting exactly what he asked for but soon discovers that some desires come at a dark, sinister price.",2026-05-13,Obsession,7.9,497
1304313,Lee Cronin's The Mummy,en,"The young daughter of a journalist disappears into the desert without a trace—eight years later, the broken family is shocked when she is returned to them, as what should be a joyful reunion turns into a living nightmare.",2026-04-15,Lee Cronin's The Mummy,8.056,1548
1433117,Kara,ta,"A thief tries to go straight, but when predatory banks trap his father in debt, he returns to crime — with a determined cop closing in on his trail.",2026-04-30,கர,5.8,14
1380291,Tom Clancy's Jack Ryan: Ghost War,en,"Jack Ryan is reluctantly pulled back into espionage when an international covert mission unravels a deadly conspiracy. Racing against time, he joins CIA allies Mike November & James Greer and sharp MI6 officer Emma Marlowe to battle a rogue black-ops unit in a high-stakes, deeply personal fight.",2026-05-20,Tom Clancy's Jack Ryan: Ghost War,7.105,457
1083381,Backrooms,en,A strange doorway appears in the basement of a furniture showroom.,2026-05-27,Backrooms,6.7,275
1439930,The Punisher: One Last Kill,en,"As Frank Castle searches for meaning beyond revenge, an unexpected force pulls him back into the fight.",2026-05-12,The Punisher: One Last Kill,8.363,1425
687163,Project Hail Mary,en,"Science teacher Ryland Grace wakes up on a spaceship light years from home with no recollection of who he is or how he got there. As his memory returns, he begins to uncover his mission: solve the riddle of the mysterious substance causing the sun to die out. He must call on his scientific knowledge and unorthodox ideas to save everything on Earth from extinction.",2026-03-15,Project Hail Mary,8.654,4562
1226863,The Super Mario Galaxy Movie,en,"Having thwarted Bowser's previous plot to marry Princess Peach, Mario and Luigi now face a fresh threat in Bowser Jr., who is determined to liberate his father from captivity and restore the family legacy. Alongside companions new and old, the brothers travel across the stars to stop the young heir's crusade.",2026-04-01,The Super Mario Galaxy Movie,8.116,2293
1582770,Dhurandhar: The Revenge,hi,"As rival gangs, corrupt officials and a ruthless Major Iqbal close in, Hamza's mission for his country spirals into a bloody personal war where the line between patriot and monster disappears in the streets of Lyari.",2026-03-18,धुरंधर: द रिवेंज,7.3,106
1007757,Swapped,en,"A small woodland creature and a majestic bird, two natural sworn enemies of the Valley, magically trade places and set off on an adventure of a lifetime to switch back. Their journey soon uncovers a greater threat—one that could endanger not only their species, but the entire valley they call home.",2026-05-01,Swapped,8.976,1540
1523145,Your Heart Will Be Broken,ru,"High school student Polina is saved from bullying at her new school and makes a deal with the main bully Bars: he must pretend to be her boyfriend and protect her, and she must do everything he says. During this game, the couple develops real feelings, but her family and classmates have reasons to separate the lovers.",2026-03-26,Твоё сердце будет разбито,6.8,83
603,The Matrix,en,"Set in the 22nd century, The Matrix tells the story of a computer hacker who joins a group of underground insurgents fighting the vast and powerful computers who now rule the earth.",1999-03-31,The Matrix,8.246,27935
1065834,Kattalan,ml,"Power-hungry forces clash in the Ivory cartel war-a fierce story of control, vengeance, and survival where compassion vanishes and only the ruthless endure.",2026-05-14,കാട്ടാളൻ,6.0,1
1371023,Chand Mera Dil,hi,"Aarav and Chandni's passionate college romance is struck by adulthood far too soon, forcing the two young lovers to balance their ambitions with responsibility and realize the evolved meaning of love.",2026-05-22,चाँद मेरा दिल,3.833,3
1419406,The Shadow's Edge,zh,Macau Police brings the tracking expert police officer out of retirement to help catch a dangerous group of professional thieves.,2025-08-16,捕风追影,7.558,755
405818,Door II: Tokyo Diary,ja,Ai is a call girl that makes good money for what she does but there’s always at risk no matter how good the money is.,1991-04-25,Door II: Tokyo Diary,6.071,14
1116201,Iron Lung,en,"In a post-apocalyptic future where an event known as ""The Quiet Rapture"" caused all known stars and habitable planets in the universe to disappear, a convict is sent to search an ocean of blood discovered on a desolate moon, using a small submarine nicknamed the ""Iron Lung"".",2026-01-30,Iron Lung,7.172,195
976912,Graphic Desires,en,"When reclusive Franklin cheats on his partner with a mysterious girl he meets on a dating app, it becomes the start of a deadly obsession.",2023-08-31,Graphic Desires,6.951,81
83533,Avatar: Fire and Ash,en,"In the wake of the devastating war against the RDA and the loss of their eldest son, Jake Sully and Neytiri face a new threat on Pandora: the Ash People, a violent and power-hungry Na'vi tribe led by the ruthless Varang. Jake's family must fight for their survival and the future of Pandora in a conflict that pushes them to their emotional and physical limits.",2025-12-17,Avatar: Fire and Ash,7.547,3301
1228710,The Mandalorian and Grogu,en,"The evil Empire has fallen, and Imperial warlords remain scattered throughout the galaxy. As the fledgling New Republic works to protect everything the Rebellion fought for, they have enlisted the help of legendary Mandalorian bounty hunter Din Djarin and his young apprentice Grogu.",2026-05-20,The Mandalorian and Grogu,6.858,379
1510339,Mark,kn,"Mark is suspended from his police duties for his unruly yet effective ways of operating, but when 18 children are abducted and found dead, races to catch the criminals. With only 18 hours left, he must confront powerful foes and use unconventional tactics to succeed.",2025-12-25,ಮಾರ್ಕ್,4.0,1
249397,Nymphomaniac: Vol. II,en,The continuation of Joe's sexually dictated life delves into the darker aspects of her adult life and what led to her being in Seligman's care.,2013-12-25,Nymphomaniac: Vol. II,6.712,3171
931285,Mortal Kombat II,en,"The fan favorite champions—now joined by Johnny Cage himself—are pitted against one another in the ultimate, no-holds barred, gory battle to defeat the dark rule of Shao Kahn that threatens the very existence of the Earthrealm and its defenders.",2026-05-06,Mortal Kombat II,6.734,366
1320660,Pati Patni Aur Woh Do,hi,"A seemingly perfect marriage in Prayagraj takes an unexpected turn when one decision leads to a chain of misunderstandings, suspicion, and comedic chaos.",2026-05-15,पति पत्नी और वो दो,7.5,4
1367220,Karuppu,ta,"In a world where justice falters, guardian deity Vettai Karuppu takes the guise of a lawyer to battle a corrupt legal system preying on the powerless.",2026-05-14,கருப்பு,7.364,11
350,The Devil Wears Prada,en,"A young woman from the Midwest gets more than she bargained for when she moves to New York to become a writer and ends up as the assistant to the tyrannical, larger-than-life editor-in-chief of a major fashion magazine.",2006-06-29,The Devil Wears Prada,7.427,13643
1390300,Over Your Dead Body,en,"A dysfunctional couple head to a remote cabin to ""reconnect"", but each has secret intentions to kill the other.",2026-04-24,Over Your Dead Body,6.8,85
460465,Mortal Kombat,en,"Washed-up MMA fighter Cole Young, unaware of his heritage, and hunted by Emperor Shang Tsung's best warrior, Sub-Zero, seeks out and trains with Earth's greatest champions as he prepares to stand against the enemies of Outworld in a high stakes battle for the universe.",2021-04-07,Mortal Kombat,7.037,6688
186745,Rape of Love,fr,"Nicole, nurse in Grenoble, is raped one night by four men. Deeply scarred, emotionally and physically, she thinks she will never recover from the trauma. Following a friend's advice, she decides to file a lawsuit.",1978-01-10,L'Amour violé,5.6,24
1327819,Hoppers,en,"Scientists have discovered how to 'hop' human consciousness into lifelike robotic animals, allowing people to communicate with animals as animals. Animal lover Mabel seizes an opportunity to use the technology, uncovering mysteries within the animal world beyond anything she could have imagined.",2026-03-04,Hoppers,8.2,1345
11012,Damage,en,The life of a respected British politician at the height of his career crumbles when he becomes obsessed with his son's lover.,1992-12-02,Damage,6.555,681
44980,Zero Woman 2,ja,"When a valuable suitcase is stolen, the mob, petty criminals, and a beautiful agent from the Elite Zero division are pulled into a battle to settle the score.",1995-09-05,Zero WOMAN ＩＩ　警視庁０課の女,5.0,8
1430077,Hokum,en,"When novelist Ohm Bauman retreats to a remote inn to scatter his parents' ashes, he is consumed by tales of a witch haunting the honeymoon suite. Disturbing visions and a shocking disappearance forces him to confront dark corners of his past.",2026-04-29,Hokum,7.08,94
1311031,Demon Slayer: Kimetsu no Yaiba Infinity Castle,ja,"The Demon Slayer Corps are drawn into the Infinity Castle, where Tanjiro, Nezuko, and the Hashira face terrifying Upper Rank demons in a desperate fight as the final battle against Muzan Kibutsuji begins.",2025-07-18,劇場版「鬼滅の刃」無限城編 第一章 猗窩座再来,7.728,847
1472951,Infiltrate,en,"In a city overrun by crime, government Agent Lily Chen is forced to choose between her duty and her family when her husband is kidnapped, and she’s blackmailed into assassinating high-level criminals to save him. As she delves deeper into the criminal underworld, Lily’s relentless pursuit of justice unravels a web of corruption, leading to a final, life-altering decision that will change her world forever.",2026-04-10,Infiltrate,5.469,16
1318447,Apex,en,A grieving woman pushing her limits on a solo adventure in the Australian wild is ensnared in a twisted game with a cunning killer who thinks she's prey.,2026-04-24,Apex,6.737,1342
1297842,GOAT,en,"A small goat with big dreams gets a once-in-a-lifetime shot to join the pros and play roarball, a high-intensity, co-ed, full-contact sport dominated by the fastest, fiercest animals in the world.",2026-02-11,GOAT,8.119,721
936075,Michael,en,"The story of Michael Jackson, one of the most influential artists the world has ever known, and his life beyond the music. His journey from the discovery of his extraordinary talent as the lead of the Jackson Five, to the visionary artist whose creative ambition fueled a relentless pursuit to become the biggest entertainer in the world, highlighting both his life off-stage and some of the most iconic performances from his early solo career.",2026-04-22,Michael,7.581,899
848116,Rocky Aur Rani Kii Prem Kahaani,hi,"Gym-freak brat Rocky falls in love with Rani, who comes from a well-educated Bengali family. Being from polar opposite worlds, the two decide to switch their families to adjust to each other's cultures and backgrounds and to know if their marriage will survive. Rocky and Rani are trapped in a world where they are united by love but divided by families and the ultimate question is will they fit in?",2023-07-28,रॉकी और रानी की प्रेम कहानी,6.2,87
1239134,Bhooth Bangla,hi,"A man inherits a palace in rural Mangalpur and plans his sister's wedding there, but strange supernatural events and panicked locals force him to investigate the property's mysterious past.",2026-04-16,भूत बंगला,6.5,10
1291608,Dhurandhar,hi,"A mysterious traveler slips into the heart of Karachi's underbelly and rises through its ranks with lethal precision, only to tear the notorious ISI-Underworld nexus apart from within.",2025-12-05,धुरंधर,7.2,291
1252051,Disforia,es,"Set in the near future against the backdrop of widespread looting and societal collapse, the couple formed by Esther and Tomás and their daughter Say move to their summer house so they can promptly sell it and then flee from their country to France, drawing attention from a ring of voyeurs of real-life torture streamed on the dark web.",2025-09-20,Disforia,4.833,6
1571594,The Photographer,es,"Inna, a young post-mortem photographer, arrives at a remote orphanage in northern Spain to capture the final image of Alejandra, a girl found dead under mysterious circumstances. But as her lens lingers on the tragedy, Inna begins to sense a dark presence within the orphanage's walls-an evil that refuses to remain hidden and threatens to make her its next subject.",2025-10-30,La fotógrafa,7.0,2
1084242,Zootopia 2,en,"After cracking the biggest case in Zootopia's history, rookie cops Judy Hopps and Nick Wilde find themselves on the twisting trail of a great mystery when Gary De'Snake arrives and turns the animal metropolis upside down. To crack the case, Judy and Nick must go undercover to unexpected new parts of town, where their growing partnership is tested like never before.",2025-11-26,Zootopia 2,7.651,2869
28322,Madness,it,"An escaped convicted murderer invades the cottage of a man, his wife and the wife's sister, whereupon he proceeds to torment this already dysfunctional trio with rape and violence.",1980-03-20,Vacanze per un massacro,4.969,32
1292415,Beast,en,"MMA legend Patton James, now a commercial fisherman, is pulled back into the cage when his brother is in danger. Reuniting with his old coach Sammy, he commits to one final fight in one championship against the brutal champion Xavier Grau.",2026-04-10,Beast,6.228,46
39254,Real Steel,en,"Charlie Kenton is a washed-up fighter who retired from the ring when robots took over the sport. After his robot is trashed, he reluctantly teams up with his estranged son to rebuild and train an unlikely contender.",2011-09-28,Real Steel,7.095,9165
235271,Addicted,en,A gallerist risks her family and flourishing career when she enters into an affair with a talented painter and slowly loses control of her life.,2014-10-10,Addicted,5.918,446
744275,After We Fell,en,"Just as Tessa's life begins to become unglued, nothing is what she thought it would be. Not her friends nor her family. The only person that she should be able to rely on is Hardin, who is furious when he discovers the massive secret that she's been keeping. Before Tessa makes the biggest decision of her life, everything changes because of revelations about her family.",2021-09-01,After We Fell,7.004,2743
1699574,Deool Band 2,mr,"The story follows a farmer who decides to question and test his faith, setting off a journey filled with emotional and life-altering moments. At its core, the narrative centers on a woman who tirelessly struggles for her family, facing hardships with resilience, as her path ultimately leads her to confront the very idea of divine power",2026-05-21,देऊळ बँड 2,0.0,0
278,The Shawshank Redemption,en,"Imprisoned in the 1940s for the double murder of his wife and her lover, upstanding banker Andy Dufresne begins a new life at the Shawshank prison, where he puts his accounting skills to work for an amoral warden. During his long stretch in prison, Dufresne comes to be admired by the other inmates -- including an older prisoner named Red -- for his integrity and unquenchable sense of hope.",1994-09-23,The Shawshank Redemption,8.721,30472
879945,The Unknown Man,nl,"Louis, a Flemish writer, decides to isolate himself at the Côte d’Azur, hoping this place will bring him inspiration.",2021-10-16,L'homme inconnu,7.8,4
1122573,In the Grey,en,"A covert team of elite operatives are living in the shadows. When a ruthless despot steals a billion-dollar fortune, they're sent to take it back—an impossible heist that erupts into a deadly game of strategy, deception and survival.",2026-05-13,In the Grey,6.592,109
1431071,System,hi,"When Neha Rajvansh, a privileged public prosecutor, meets Sarika Rawat, a courtroom stenographer from a humble background, their lives are thrown into upheaval where power defines truth, blurring the system and raising a question of what justice truly means to them.",2026-05-22,सिस्टम,7.5,2
157336,Interstellar,en,The adventures of a group of explorers who make use of a newly discovered wormhole to surpass the limitations on human space travel and conquer the vast distances involved in an interstellar voyage.,2014-11-05,Interstellar,8.476,39900
1426822,Mortal Game,en,"A group of hunters travel to a mysterious island to track down a legendary forest creature. They soon realize their guide has set them up as bait, forcing them to confront a highly intelligent predator that terrorizes them one by one.",2025-02-03,Mortal Game,4.917,12
1273221,Scary Movie,en,"Twenty-six years after outrunning a suspiciously familiar masked killer, the Core Four are back in the killer's crosshairs and no horror movie IP is safe.",2026-06-03,Scary Movie,5.46,25
1103473,KD – The Devil,kn,"In the early 1970s, a petty criminal Kaali unwittingly involves himself with underworld thugs, catalyzing events beyond his control.",2026-04-30,ಕೆಡಿ - ದಿ ಡೆವಿಲ್,5.0,1
980431,Avatar Aang: The Last Airbender,en,"Avatar Aang, the world's last Airbender, learns of an ancient power that could save his culture from extinction. With the help of his friends, he embarks on a global quest to find it before it falls into the wrong hands and threatens to upend the peace they sacrificed everything to achieve.",2026-10-09,Avatar Aang: The Last Airbender,0.0,0
454639,Masters of the Universe,en,"After being separated for 15 years, the Sword of Power leads Prince Adam back to Eternia, where he discovers his home shattered under the fiendish rule of Skeletor. To save his family and his world, Adam must join forces with his closest allies, Teela and Duncan/Man-At-Arms, and embrace his true destiny as He-Man — the most powerful man in the universe.",2026-06-03,Masters of the Universe,7.575,20
1316427,7 Dogs,ar,Interpol agent Khalid Al-Azzazi joins forces with Ghali Abu Dawood from the 7 Dogs crime syndicate to fight drug trafficking.,2026-05-27,7 كلاب,2.0,2
1368166,The Housemaid,en,"Trying to escape her past, Millie Calloway accepts a job as a live-in housemaid for the wealthy Nina and Andrew Winchester. But what begins as a dream job quickly unravels into something far more dangerous—a sexy, seductive game of secrets, scandal, and power.",2025-12-18,The Housemaid,7.247,2299
1157008,Dime lo que quieres (de verdad),es,"Diego and Emilia are a conservative couple with 16 years of marriage who have lost the spark, until Tomás and Betina rescue them and introduce them to the forbidden world, changing what they know about intimacy, relationships, and sex.",2023-07-27,Dime lo que quieres (de verdad),7.629,31
1290821,Shelter,en,"A man living in self-imposed exile on a remote island rescues a young girl from a violent storm, setting off a chain of events that forces him out of seclusion to protect her from enemies tied to his past.",2026-01-28,Shelter,7.626,1103
1368881,Ladies First,en,"An arrogant but charismatic ladies' man finds his life of money, power and casual flings upended when he wakes up in a parallel world dominated by women.",2026-05-21,Ladies First,6.008,246
441168,From Straight A's to XXX,en,"When a change of circumstances leaves Miriam unable to pay her college tuition, she makes a surprising decision: to start performing in adult films, using the pseudonym Belle Knox. Miriam lies to her family and her friends at school, keeping her double life a secret. But soon rumours spread and Miriam becomes the subject of vicious online attacks and unwanted attention. Miriam fights back: she talks to the media, saying her new line of work empowers her as a feminist. But her confident stand has unintended consequences. Miriam is shunned by her conservative family and her colleagues in the adult film world. One impulsive decision has quickly spiralled out of control - and Miriam's problems are just beginning.",2017-02-11,From Straight A's to XXX,5.843,162
1242898,Predator: Badlands,en,"Cast out from his clan, a young Predator finds an unlikely ally in a damaged android and embarks on a treacherous journey in search of the ultimate adversary.",2025-11-05,Predator: Badlands,7.76,2995
840464,Greenland 2: Migration,en,"Having found the safety of the Greenland bunker after the comet Clarke decimated the Earth, the Garrity family must now risk everything to embark on a perilous journey across the wasteland of Europe to find a new home.",2026-01-07,Greenland 2: Migration,6.4,1146
1375646,Colony,ko,"Professor Se-jeong is thrust into a bloody nightmare when a rapidly mutating virus is released during a biotech conference causing authorities to seal the facility. Trapped inside with no escape, Se-jeong along with a small group of survivors must fight to stay alive while the infected undergo horrific transformations.",2026-05-21,군체,6.485,34
1301421,The Sheep Detectives,en,"George Hardy is a shepherd who reads detective novels to his beloved sheep every night, assuming they can't possibly understand. But when a mysterious incident disrupts life on the farm, the sheep realize they must become the detectives. As they follow the clues and investigate human suspects, they prove that even sheep can be brilliant crime-solvers.",2026-04-30,The Sheep Detectives,7.658,146
1330021,Remarkably Bright Creatures,en,"Through unlikely bonds formed during night shifts at a local aquarium, Tova, an elderly widow, learns of a life-changing discovery that may bring her joy and wonder once again.",2026-05-07,Remarkably Bright Creatures,8.533,532
1515729,Blast,ta,Follows a family trained to protect the powerless who become the most dangerous obstacle of all.,2026-05-28,Blast,7.0,3
1242265,Fuze,en,An unexploded WWII bomb is discovered on a busy construction site in the centre of London. Chaos ensues as the military and police begin a mass evacuation against a ticking clock.,2026-03-23,Fuze,6.422,90
1632181,Accidental Partners,es,Two women discover they were both scammed by the same man (who also got them pregnant). They form an alliance to take revenge.,2026-03-12,Socias por accidente,9.074,217
1275779,Disclosure Day,en,"If you found out we weren’t alone, if someone showed you, proved it to you, would that frighten you?",2026-06-10,Disclosure Day,8.0,1
1663082,The Last Supper,en,"In a deserted house, a mysterious man savors an exquisite menu in the company of an unseen guest. From this eerie dinner table, a succession of terrifying stories is revealed-each probing primal fears of hunger, flesh, and survival.",2025-10-23,The Last Supper,10.0,1
64641,Monika,it,"Monika is young, beautiful and a virgin. She is only 16 years old, and, beside getting the attention of all her classmates, she also attracts older men. She has a relationship with a boy, Leo, but she doesn't know that he uses to pimp the girls he seduces to rich businessmen. One of Leo's client befriends Monika and becomes so obsessed that he pays Leo to get her. But Monika turns her attention to her art professor, unknowing that he too has his secrets.",1974-02-28,La ragazzina,4.7,20
1628367,Kartavya,hi,"With his family's safety at stake and menacing threats closing in, a police officer must decide how far he'll go to uphold his duty.",2026-05-15,कर्त्तव्य,6.5,18
1639398,Mexican Psycho,es,"Follows an ""ultra-violent and intelligent"" psychopath who challenges the police by leaving a white paper rabbit at each crime scene, connecting them all.",2026-03-19,Psicópata: El Asesino del Conejo Blanco,7.425,80
755898,War of the Worlds,en,"Will Radford is a top analyst for Homeland Security who tracks potential threats through a mass surveillance program, until one day an attack by an unknown entity leads him to question whether the government is hiding something from him... and from the rest of the world.",2025-07-29,War of the Worlds,4.105,1002
78192,Michael Jackson: The Life of an Icon,en,"See Michael Jackson, one of the most recognizable and popular entertainers of all time, like never before in the feature-length tribute Michael Jackson: The Life of an Icon. Known to millions of fans worldwide for his record-breaking albums, groundbreaking music videos, mesmerizing dance moves and humanitarian efforts, his true story has never really been told...until now. This unprecedented look into the King of Pop's fascinating life includes all-new interviews with his mother Katherine Jackson as well as siblings Tito and Rebbie Jackson,  his nephew  Jaafar Jackson and niece Tahkyah brings plenty Jackson and Friends ends and music legends such as Smokey Robinson, Dionne Warwick and  his 3 children and many more.",2011-11-02,Michael Jackson: The Life of an Icon,8.137,182
1196067,Worldbreaker,en,"Five years ago, a tear in the fabric of reality brought creatures to our world from an alternate dimension bent on our destruction. A father hides his daughter on an island to keep her safe while he prepares her for survival and the battles to come. But when the world is about to break, no place is safe.",2025-10-30,Worldbreaker,6.048,199
1002398,Virgin,tl,"Iris, an 18-year old virgin marries Joaquin, a rich widower, because of money. However, when he learns that Iris is not really a virgin, their honeymoon turns to a bloodbath.",2024-10-29,Donselya,6.591,22
1325734,The Drama,en,A happily engaged couple is put to the test when an unexpected turn sends their wedding week off the rails.,2026-03-26,The Drama,6.956,919
