id,title,original_language,overview,release_date,original_title,vote_average,vote_count
8363,Superbad,en,Two co-dependent high school seniors are forced to deal with separation anxiety after their plan to stage a booze-soaked party goes awry.,2007-08-17,Superbad,7.264,8088
8363,Superbad,en,Two co-dependent high school seniors are forced to deal with separation anxiety after their plan to stage a booze-soaked party goes awry.,2007-08-17,Superbad,7.264,8088
408,Snow White and the Seven Dwarfs,en,"A beautiful girl, Snow White, takes refuge in the forest in the house of seven dwarfs to hide from her stepmother, the wicked Queen. The Queen is jealous because she wants to be known as ""the fairest in the land,"" and Snow White's beauty surpasses her own.",1938-01-22,Snow White and the Seven Dwarfs,7.1,7982
1511057,Roommates,en,"When shy college freshman Devon asks cool-girl Celeste to be her roommate, a blossoming friendship quickly spirals into a war of passive aggression.",2026-04-13,Roommates,6.595,122
593643,The Menu,en,"A young couple travels to a remote island to eat at an exclusive restaurant where the chef has prepared a lavish menu, with some shocking surprises.",2022-11-17,The Menu,7.178,6228
1032823,Trap,en,"A father and teen daughter attend a pop concert, where they realize they're at the center of a dark and sinister event.",2024-07-31,Trap,6.24,2839
45243,The Hangover Part II,en,"The Hangover crew heads to Thailand for Stu's wedding. After the disaster of a bachelor party in Las Vegas last year, Stu is playing it safe with a mellow pre-wedding brunch. However, nothing goes as planned and Bangkok is the perfect setting for another adventure with the rowdy group.",2011-05-25,The Hangover Part II,6.507,11281
254,King Kong,en,"In 1933 New York, an overly ambitious movie producer coerces his cast and hired ship crew to travel to mysterious Skull Island, where they encounter Kong, a giant ape who is immediately smitten with the leading lady.",2005-12-12,King Kong,6.891,8504
268,Batman,en,"Having witnessed his parents' brutal murder as a child, millionaire philanthropist Bruce Wayne fights crime in Gotham City disguised as Batman, a costumed hero who strikes fear into the hearts of villains. But when a deformed madman known as 'The Joker' seizes control of Gotham's criminal underworld, Batman must face his most ruthless nemesis ever while protecting both his identity and his love interest, reporter Vicki Vale.",1989-06-21,Batman,7.2,8572
11688,The Emperor's New Groove,en,"When the self‑absorbed Emperor Kuzco is accidentally transformed into a llama, he must rely on a humble villager to survive the jungle and reclaim his throne.",2000-12-15,The Emperor's New Groove,7.561,7302
1556783,TN 2026,ta,"Set in Pollachi, the story follows a powerful landlord, Sivalingam Mandradiyar, who becomes obsessed with a rising actor, Kukanth Kumar, believing he is the next M.G.R. He pours his wealth into shaping the actor's career and political future. But as ambition and fame grow, so does the risk of downfall. Will it lead to power or ruin?",2026-04-10,TN 2026,0.0,0
73,American History X,en,"Derek Vineyard is paroled after serving 3 years in prison for killing two African-American men. Through his brother, Danny Vineyard's narration, we learn that before going to prison, Derek was a skinhead and the leader of a violent white supremacist gang that committed acts of racial crime throughout L.A. and his actions greatly influenced Danny. Reformed and fresh out of prison, Derek severs contact with the gang and becomes determined to keep Danny from going down the same violent path as he did.",1998-07-01,American History X,8.327,12577
620249,The Legend of Hei,zh,"When cat spirit Luo Xiaohei's home is deforested by humans, he must find a new one. He runs into a group of other spirit creatures who take him under their wing with dreams of reconquering the land they say is rightfully theirs. However, they run into a human known as Wuxian who separates Luo Xiaohei from the other spirits and the two go on a journey, with the cat spirit learning to control his abilities as well as forming his own thoughts on whether or not he should ally with the spirits or the humans.",2019-08-27,罗小黑战记,8.294,470
4476,Legends of the Fall,en,"In early 20th-century Montana, Col. William Ludlow lives on a ranch in the wilderness with his sons, Alfred, Tristan, and Samuel. Eventually, the unconventional but close-knit family are bound by loyalty, tested by war, and torn apart by love, as told over the course of several decades in this epic saga.",1994-12-23,Legends of the Fall,7.4,2853
287649,Scarlet Innocence,ko,"A university professor gradually succumbing to blindness is entranced by an obsessive love, in this modern-day adaptation of a classic Korean fairy tale.",2014-10-02,마담 뺑덕,6.1,69
124905,Godzilla,en,"Ford Brody, a Navy bomb expert, has just reunited with his family in San Francisco when he is forced to go to Japan to help his estranged father, Joe. Soon, both men are swept up in an escalating crisis when an ancient alpha predator arises from the sea to combat malevolent adversaries that threaten the survival of humanity. The creatures leave colossal destruction in their wake, as they make their way toward their final battleground: San Francisco.",2014-05-14,Godzilla,6.361,9791
4564,Sex and the City,en,A New York writer on sex and love is finally getting married to her Mr. Big. But her three best girlfriends must console her after one of them inadvertently leads Mr. Big to jilt her.,2008-05-12,Sex and the City,6.547,2265
398818,Call Me by Your Name,en,"In the summer of 1983, a 17-year-old Elio spends his days in his family's villa in Italy. One day Oliver, a graduate student, arrives to assist Elio's father, a professor of Greco-Roman culture. Soon, Elio and Oliver discover a summer that will alter their lives forever.",2017-10-01,Call Me by Your Name,8.1,12747
74997,The Human Centipede 2 (Full Sequence),en,"Inspired by the fictional Dr. Heiter, disturbed loner Martin dreams of creating a 12-person centipede and sets out to realize his sick fantasy.",2011-10-06,The Human Centipede 2 (Full Sequence),4.764,1447
9902,Wrong Turn,en,"Chris crashes into a carload of other young people, and the group of stranded motorists is soon lost in the woods of West Virginia, where they're hunted by three cannibalistic mountain men who are grossly disfigured by generations of inbreeding.",2003-05-30,Wrong Turn,6.395,2999
935508,Female Teacher Punisher 2: Goddess of Hell,ja,"In the daytime, an ordinary high school girl's English teacher, but at night, the dynamite body of Super Lady Reiko, who defeats the villains who are infested in the world as an agent of a mysterious organization, explodes. A direct sequel to the first iteration.",1990-06-01,女教師仕置人 地獄の女神,0.0,0
399579,Alita: Battle Angel,en,"When Alita awakens with no memory of who she is in a future world she does not recognize, she is taken in by Ido, a compassionate doctor who realizes that somewhere in this abandoned cyborg shell is the heart and soul of a young woman with an extraordinary past.",2019-01-31,Alita: Battle Angel,7.253,10018
7512,Idiocracy,en,"To test its top-secret Human Hibernation Project, the Pentagon picks the most average European-Americans it can find - an Army private and a prostitute - and sends them to the year 2505 after a series of freak events. But when they arrive, they find a civilization so dumbed-down that they're the smartest people around.",2006-09-01,Idiocracy,6.373,3553
1317448,No Place to Be Single,it,"A brilliant and intelligent love comedy that celebrates second chances and new horizons, starring a strong and determined woman who settles the score.",2026-05-08,Non è un paese per single,6.673,78
176,Saw,en,"Two men wake up to find themselves shackled in a grimy, abandoned bathroom. As they struggle to comprehend their predicament, they discover a disturbing tape left behind by the sadistic mastermind known as Jigsaw. With a chilling voice and cryptic instructions, Jigsaw informs them that they must partake in a gruesome game in order to secure their freedom.",2004-10-01,Saw,7.421,10061
257211,The Intern,en,"70-year-old widower Ben Whittaker has discovered that retirement isn't all it's cracked up to be. Seizing an opportunity to get back in the game, he becomes a senior intern at an online fashion site, founded and run by Jules Ostin.",2015-09-23,The Intern,7.231,7333
194,Amélie,fr,"At a tiny Parisian café, the adorable yet painfully shy Amélie accidentally discovers a gift for helping others. Soon Amelie is spending her days as a matchmaker, guardian angel, and all-around do-gooder. But when she bumps into a handsome stranger, will she find the courage to become the star of her very own love story?",2001-04-25,Le Fabuleux Destin d'Amélie Poulain,7.921,12399
1428857,On the Hunt,en,A former military woman takes on a ruthless criminal underworld in a race against time to find her missing daughter.,2026-02-27,On the Hunt,4.45,10
423108,The Conjuring: The Devil Made Me Do It,en,"Paranormal investigators Ed and Lorraine Warren encounter what would become one of the most sensational cases from their files. The fight for the soul of a young boy takes them beyond anything they'd ever seen before, to mark the first time in U.S. history that a murder suspect would claim demonic possession as a defense.",2021-05-25,The Conjuring: The Devil Made Me Do It,7.352,6539
75656,Now You See Me,en,An FBI agent and an Interpol detective track a team of illusionists who pull off bank heists during their performances and reward their audiences with the money.,2013-05-29,Now You See Me,7.332,16791
704347,Honey Do List,en,"Walter's honey do list piles up and Frank is too busy to do the fixes, a new sexy handyman arrives with an agenda that isn't exactly on Walter's fix-it list. Can Walter resist this new temptation?",2020-06-17,Honey Do List,3.7,7
2048,"I, Robot",en,"In 2035, where robots are commonplace and abide by the three laws of robotics, a technophobic cop investigates an apparent suicide. Suspecting that a robot may be responsible for the death, his investigation leads him to believe that humanity may be in danger.",2004-07-15,"I, Robot",6.964,12659
1291659,The Wizard of the Kremlin,fr,"In the chaos of post-Soviet Russia, rising KGB officer Vladimir Putin joins forces with master manipulator Vadim Baranov to reshape life behind the Iron Curtain, using violence and deception to change the world forever.",2026-01-21,Le Mage du Kremlin,6.529,155
353081,Mission: Impossible - Fallout,en,"When an IMF mission ends badly, the world is faced with dire consequences. As Ethan Hunt takes it upon himself to fulfill his original briefing, the CIA begin to question his loyalty and his motives. The IMF team find themselves in a race against time, hunted by assassins while trying to prevent a global catastrophe.",2018-07-25,Mission: Impossible - Fallout,7.449,9135
9072,Little Man,en,"After leaving prison, dwarf criminal Calvin Sims joins his moron brother Percy in stealing an expensive huge diamond from a jewelry store for the mobster Walken. They are chased by the police, and Calvin hides the stone in the purse of executive Vanessa Edwards, whose husband Darryl Edwards wants to have a baby. Percy convinces Calvin to dress like a baby and be left in front of the Edwards' house to get inside the house and retrieve the diamond. Darryl and Vanessa keep Calvin for the weekend and decide to adopt him, while Walken threatens Darryl to get the stone back.",2006-08-31,Little Man,5.949,1902
1049471,Outcome,en,"Reef Hawk, Hollywood's poster child since age six, is not okay. When he learns about an extortion plot tied to a mysterious video, Reef preemptively sets out on a redemption tour to make amends, confront his demons, and avoid getting canceled.",2026-04-06,Outcome,5.362,203
1424965,Ice Skater,en,"A survival drama about an ice skater stranded on an ice floe at the Arctic Sea. When the ice floe starts to float towards south and melt, the ice skater must use all means necessary to survive.",2026-08-13,Ice Skater,0.0,0
1265,Bridge to Terabithia,en,"Jesse Aarons trained all summer to become the fastest runner in school. So he's very upset when newcomer Leslie Burke outruns him and everyone else. Despite this and other differences including that she's rich, he's poor, she's a city girl, and he's a country boy the two become fast friends. Together they create Terabithia, a land of monsters, trolls, ogres, and giants where they rule as king and queen.",2007-02-15,Bridge to Terabithia,7.323,5243
1501204,I Am a Plaything,ko,"Hyo-min, who became a prostitute by choice, undergoes sex training to serve clients under the supervision of Kyeong-seop, the manager of the establishment. She services countless men and even learns advanced techniques directly from Kyeong-mi, who works with her. Meanwhile, Kyeong-seop gradually opens his heart as he discovers the reason behind Hyo-min's decision to enter prostitution.",2025-06-14,나는 노리개다,0.0,0
76,Before Sunrise,en,"An unexpected meeting on a train leads two travelers to spend an evening wandering through Vienna. As the night unfolds, they share stories and conversations about life and love, exploring new ideas while a quiet intimacy grows between them, knowing it may be their only night together.",1995-01-27,Before Sunrise,8.0,4693
98566,Teenage Mutant Ninja Turtles,en,"When a kingpin threatens New York City, a group of mutated turtle warriors must emerge from the shadows to protect their home.",2014-08-07,Teenage Mutant Ninja Turtles,5.927,7183
1491902,Bang,th,"Follows a ruthless hitman who, after narrowly escaping a fatal attempt on his life, betrays his gang in an effort to find forgiveness but ends up becoming a target himself.",2025-07-11,ปัง,6.599,81
508943,Luca,en,Luca and his best friend Alberto experience an unforgettable summer on the Italian Riviera. But all the fun is threatened by a deeply-held secret: they are sea monsters from another world just below the water’s surface.,2021-06-17,Luca,7.782,8948
1584215,The Internship,en,"A CIA-trained assassin recruits other graduates from her secret childhood program, The Internship, to violently destroy the organization. The CIA fights back with deadly force.",2026-01-13,The Internship,6.274,73
26466,Triangle,en,"When Jess sets sail on a yacht with a group of friends, she cannot shake the feeling that there is something wrong.",2009-10-16,Triangle,6.919,2974
9286,Final Destination 3,en,"High school senior Wendy's premonition of a deadly rollercoaster ride saves her life and a lucky few, but not from death itself — which seeks out those who escaped their fate.",2006-02-09,Final Destination 3,6.152,4568
76493,The Dictator,en,The heroic story of a dictator who risks his life to ensure that democracy would never come to the country he so lovingly oppressed.,2012-05-15,The Dictator,6.23,6447
291805,Now You See Me 2,en,"One year after outwitting the FBI and winning the public’s adulation with their mind-bending spectacles, the Four Horsemen resurface only to find themselves face to face with a new enemy who enlists them to pull off their most dangerous heist yet.",2016-06-02,Now You See Me 2,6.8,11582
1111873,Abigail,en,"A group of criminals kidnap a teenage ballet dancer, the daughter of a notorious gang leader, in order to obtain a ransom of $50 million, but over time, they discover that she is not just an ordinary girl. After the kidnappers begin to diminish, one by one, they discover, to their increasing horror, that they are locked inside with no normal little girl.",2024-04-16,Abigail,6.663,2075
787,Mr. & Mrs. Smith,en,"A husband and wife struggle to keep their marriage alive until they realize they are both secretly working as assassins. Now, their respective assignments require them to kill each other.",2005-06-07,Mr. & Mrs. Smith,6.695,11228
299054,Expend4bles,en,"Armed with every weapon they can get their hands on and the skills to use them, The Expendables are the world’s last line of defense and the team that gets called when all other options are off the table. But new team members with new styles and tactics are going to give “new blood” a whole new meaning.",2023-09-15,Expend4bles,6.069,1883
447277,The Little Mermaid,en,"The youngest of King Triton’s daughters, and the most defiant, Ariel longs to find out more about the world beyond the sea, and while visiting the surface, falls for the dashing Prince Eric. With mermaids forbidden to interact with humans, Ariel makes a deal with the evil sea witch, Ursula, which gives her a chance to experience life on land, but ultimately places her life – and her father’s crown – in jeopardy.",2023-05-18,The Little Mermaid,6.272,3318
251,Ghost,en,"After a young man is murdered, his spirit stays behind to warn his lover of impending danger, with the help of a reluctant psychic.",1990-07-13,Ghost,7.236,6028
335787,Uncharted,en,"A young street-smart, Nathan Drake and his wisecracking partner Victor “Sully” Sullivan embark on a dangerous pursuit of “the greatest treasure never found” while also tracking clues that may lead to Nathan’s long-lost brother.",2022-02-10,Uncharted,6.888,6865
577922,Tenet,en,"Armed with only one word - Tenet - and fighting for the survival of the entire world, the Protagonist journeys through a twilight world of international espionage on a mission that will unfold in something beyond real time.",2020-08-22,Tenet,7.175,11107
38575,The Karate Kid,en,"12-year-old Dre Parker could've been the most popular kid in Detroit, but his mother's latest career move has landed him in China. Dre immediately falls for his classmate Mei Ying but the cultural differences make such a friendship impossible. Even worse, Dre's feelings make him an enemy of the class bully, Cheng. With no friends in a strange land, Dre has nowhere to turn but maintenance man Mr. Han, who is a kung fu master. As Han teaches Dre that kung fu is not about punches and parries, but maturity and calm, Dre realizes that facing down the bullies will be the fight of his life.",2010-06-10,The Karate Kid,6.568,6558
9532,Final Destination,en,"After a teenager has a terrifying vision of him and his friends dying in a plane crash, he prevents the accident only to have Death hunt them down, one by one.",2000-03-17,Final Destination,6.635,6675
585511,Luck,en,"Suddenly finding herself in the never-before-seen Land of Luck, the unluckiest person in the world must unite with the magical creatures there to turn her luck around.",2022-08-05,Luck,7.7,1950
44981,Zero Woman: Dangerous Game,ja,"In this installment of the Zero Woman series, Rei, the number-one assassin of the Tokyo Police Department's secret Zero Division, has been assigned to take out a notorious gangster responsible for dozens of murders. At the same time, she must protect the gangster's mistress from the hitmen who want to keep her from telling the police what she knows. At first, both women are upset about the arrangement, but they eventually come to appreciate each other.",1998-05-01,Zero WOMAN 危ない遊戯,4.6,5
459151,The Boss Baby: Family Business,en,The Templeton brothers — Tim and his Boss Baby little bro Ted — have become adults and drifted away from each other. But a new boss baby with a cutting-edge approach and a can-do attitude is about to bring them together again … and inspire a new family business.,2021-07-01,The Boss Baby: Family Business,7.331,2684
756999,The Black Phone,en,"Finney Blake, a shy but clever 13-year-old boy, is abducted by a sadistic killer and trapped in a soundproof basement where screaming is of little use. When a disconnected phone on the wall begins to ring, Finney discovers that he can hear the voices of the killer’s previous victims. And they are dead set on making sure that what happened to them doesn’t happen to Finney.",2022-06-16,The Black Phone,7.521,5841
585083,Hotel Transylvania: Transformania,en,"When Van Helsing's mysterious invention, the ""Monsterfication Ray,"" goes haywire, Drac and his monster pals are all transformed into humans, and Johnny becomes a monster. In their new mismatched bodies, Drac and Johnny must team up and race across the globe to find a cure before it's too late, and before they drive each other crazy.",2022-01-31,Hotel Transylvania: Transformania,7.036,3020
157350,Divergent,en,"In a world divided into factions based on personality types, Tris learns that she's been classified as Divergent and won't fit in. When she discovers a plot to destroy Divergents, Tris and the mysterious Four must find out what makes Divergents dangerous before it's too late.",2014-03-14,Divergent,6.904,13473
287947,Shazam!,en,A boy is given the ability to become an adult superhero in times of need with a single magic word.,2019-03-29,Shazam!,6.978,10198
1305781,Blades of the Guardians: Wind Rises in the Desert,zh,"Dao Ma, the ""second most wanted fugitive,"" is entrusted by his benefactor, the chief of Mo family clan, to take on a mysterious escort mission-escorting the ""most wanted fugitive"" to Chang'an.",2026-02-17,镖人：风起大漠,7.0,36
339403,Baby Driver,en,"After being coerced into working for a crime boss, a young getaway driver finds himself taking part in a heist doomed to fail.",2017-06-28,Baby Driver,7.443,16836
359724,Ford v Ferrari,en,"American car designer Carroll Shelby and the British-born driver Ken Miles work together to battle corporate interference, the laws of physics, and their own personal demons to build a revolutionary race car for Ford Motor Company and take on the dominating race cars of Enzo Ferrari at the 24 Hours of Le Mans in France in 1966.",2019-11-13,Ford v Ferrari,8.007,8979
851644,20th Century Girl,ko,"In 1999, a teen girl keeps close tabs on a boy in school on behalf of her deeply smitten best friend – then she gets swept up in a love story of her own.",2022-10-06,20세기 소녀,8.154,814
37169,The Human Centipede (First Sequence),en,"During a stopover in Germany in the middle of a carefree road trip through Europe, two American girls find themselves alone at night when their car breaks down in the woods. Searching for help at a nearby villa, they are wooed into the clutches of a deranged retired surgeon, who has a very disturbed vision.",2009-10-31,The Human Centipede (First Sequence),5.185,2389
683205,The Legend Hunters,zh,The story follows the team as they try to raid a tomb made by master tomb raiders. It is set partially in Russia and will involve scenes at Catherine Palace in St. Petersburg.,2026-05-28,寻龙诀：觅踪,0.0,0
399402,Hunter Killer,en,"Untested American submarine commander, Capt. Joe Glass of the USS Arkansas, is on the hunt for a U.S. sub in distress in the Arctic Ocean. He soon learns a secret Russian coup is in the offing, a conspiracy that threatens to dismantle the world order. With crew and country on the line, Glass must coordinate with an elite group of Navy SEALs to sneak through enemy waters, rescue the kidnapped Russian president, and hopefully prevent World War III.",2018-10-19,Hunter Killer,6.911,2405
452557,Wolf Warrior 2,zh,"China's deadliest special forces operative settles into a quiet life on the sea. When sadistic mercenaries begin targeting nearby civilians, he must leave his newfound peace behind and return to his duties as a soldier and protector.",2017-07-27,战狼2,6.509,332
335988,Transformers: The Last Knight,en,"Humans and Transformers are at war. Optimus Prime is gone. The key to saving our future lies buried in the secrets of the past, in the hidden history of Transformers on Earth. Saving our world falls upon the shoulders of an unlikely alliance: Cade Yeager; Bumblebee; an English Lord; and an Oxford Professor.",2017-06-16,Transformers: The Last Knight,6.059,6718
5503,The Fugitive,en,"Wrongfully convicted of murdering his wife and sentenced to death, Richard Kimble escapes from the law in an attempt to find the real killer and clear his name.",1993-08-06,The Fugitive,7.48,4795
812037,Last Summer,fr,"One summer, a French teenager who has been living with his mother in the city moves in with his estranged father’s family in the countryside, where he clashes with his stepmother.",2023-09-13,L'Été dernier,6.091,246
1688652,Gary,en,"Two friends go on a work trip and encounter unexpected challenges and local personalities as they navigate their assignment. Their efforts to adapt to unfamiliar surroundings highlights moments of humor, small-town culture and the unpredictable nature of work travel. As they troubleshoot problems, their experience leaves a lasting impression and offers new perspectives on their friendship.",2026-05-05,Gary,6.387,31
278154,Ice Age: Collision Course,en,"Set after the events of Continental Drift, Scrat's epic pursuit of his elusive acorn catapults him outside of Earth, where he accidentally sets off a series of cosmic events that transform and threaten the planet. To save themselves from peril, Manny, Sid, Diego, and the rest of the herd leave their home and embark on a quest full of thrills and spills, highs and lows, laughter and adventure while traveling to exotic new lands and locations.",2016-06-23,Ice Age: Collision Course,6.113,4871
381288,Split,en,"Though Kevin has evidenced 23 personalities to his trusted psychiatrist, Dr. Fletcher, there remains one still submerged who is set to materialize and dominate all the others. Compelled to abduct three teenage girls led by the willful, observant Casey, Kevin reaches a war for survival among all of those contained within him — as well as everyone around him — as the walls between his compartments shatter apart.",2017-01-19,Split,7.341,18325
