id,title,original_language,overview,release_date,original_title,vote_average,vote_count
519465,Queen of Hearts,da,"Anne, a brilliant and dedicated advocacy lawyer specialising in society’s most vulnerable, children and young adults, lives what appears to be the picture-perfect life with her doctor-husband, Peter, and their twin daughters. When her estranged teenage stepson, Gustav, moves in with them, Anne’s escalating desire leads her down a dangerous rabbit hole which, once exposed, unleashes a sequence of events destined to destroy her world.",2019-03-27,Dronningen,6.915,377
1083637,Kantara - A Legend: Chapter 1,kn,"During the Kadamba reign, King Vijayendra, the ruler of the fictional feudatory land of Bangra, meets his final fate while venturing into the mystical forest of Kantara. Witnessing this, his son Rajashekara seals the borders of their realm. Later, Prince Kulashekara reopens them through a brutal massacre. The protagonist, Berme, in search of prosperity, crosses the divide and ignites a conflict of faith, power, and destiny between the Kingdom and Nature.",2025-10-01,ಕಾಂತಾರ: ಅಧ್ಯಾಯ - ೧,7.159,82
1510745,Bodycam,en,"A call to a quiet suburban home unleashes unthinkable carnage when two officers mistakenly shoot a man and his infant child, spiraling the tragedy into a fierce, unrelenting fall into the unknown.",2026-03-12,Bodycam,5.716,58
245891,John Wick,en,Ex-hitman John Wick comes out of retirement to track down the gangsters that took everything from him.,2014-10-16,John Wick,7.456,20840
19173,Diary of a Nymphomaniac,es,"A chronicle of the life of a middle-class French girl's sexual adventures, her then fall into prostitution, and her ultimate redemption.",2008-10-17,Diario de una ninfómana,5.643,364
953,Madagascar,en,Four animal friends get a taste of the wild life when they break out of captivity at the Central Park Zoo and wash ashore on the island of Madagascar.,2005-05-25,Madagascar,6.923,11724
447365,Guardians of the Galaxy Vol. 3,en,"Peter Quill, still reeling from the loss of Gamora, must rally his team around him to defend the universe along with protecting one of their own. A mission that, if not completed successfully, could quite possibly lead to the end of the Guardians as we know them.",2023-05-03,Guardians of the Galaxy Vol. 3,7.931,8333
1191876,From the Ashes,en,"Jailed for her husband's crime, a woman discovers that her only way out is to solve riddles from her mysterious past.",2027-06-01,From the Ashes,0.0,0
127585,X-Men: Days of Future Past,en,The ultimate X-Men ensemble fights a war for the survival of the species across two time periods as they join forces with their younger selves in an epic battle that must change the past – to save our future.,2014-05-15,X-Men: Days of Future Past,7.53,16257
128,Princess Mononoke,ja,"Ashitaka, a prince of the disappearing Emishi people, is cursed by a demonized boar god and must journey to the west to find a cure. Along the way, he encounters San, a young human woman fighting to protect the forest, and Lady Eboshi, who is trying to destroy it. Ashitaka must find a way to bring balance to this conflict.",1997-07-12,もののけ姫,8.321,8980
489,Good Will Hunting,en,"Will Hunting is a headstrong, working-class genius who is failing the lessons of life. After one too many run-ins with the law, Will's last chance is a psychology professor, who might be the only man who can reach him.",1997-12-05,Good Will Hunting,8.2,13847
292431,Love,fr,"Murphy is an American living in Paris who enters a highly sexually and emotionally charged relationship with the unstable Electra. Unaware of the seismic effect it will have on their relationship, they invite their pretty neighbor into their bed.",2015-07-15,Love,6.5,2668
508442,Soul,en,"Joe Gardner is a middle school teacher with a love for jazz music. After a successful audition at the Half Note Club, he suddenly gets into an accident that separates his soul from his body and is transported to the You Seminar, a center in which souls develop and gain passions before being transported to a newborn child. Joe must enlist help from the other souls-in-training, like 22, a soul who has spent eons in the You Seminar, in order to get back to Earth.",2020-12-25,Soul,8.093,11416
337404,Cruella,en,"In 1970s London amidst the punk rock revolution, a young grifter named Estella is determined to make a name for herself with her designs. She befriends a pair of young thieves who appreciate her appetite for mischief, and together they are able to build a life for themselves on the London streets. One day, Estella’s flair for fashion catches the eye of the Baroness von Hellman, a fashion legend who is devastatingly chic and terrifyingly haute. But their relationship sets in motion a course of events and revelations that will cause Estella to embrace her wicked side and become the raucous, fashionable and revenge-bent Cruella.",2021-05-26,Cruella,7.971,10062
694,The Shining,en,"Jack Torrance accepts a caretaker job at the Overlook Hotel, where he, along with his wife Wendy and their son Danny, must live isolated from the rest of the world for the winter. But they aren't prepared for the madness that lurks within.",1980-05-23,The Shining,8.204,18928
283995,Guardians of the Galaxy Vol. 2,en,The Guardians must fight to keep their newfound family together as they unravel the mysteries of Peter Quill's true parentage.,2017-04-25,Guardians of the Galaxy Vol. 2,7.61,22935
284053,Thor: Ragnarok,en,"Thor is imprisoned on the other side of the universe and finds himself in a race against time to get back to Asgard to stop Ragnarok, the destruction of his home-world and the end of Asgardian civilization, at the hands of a powerful new threat, the ruthless Hela.",2017-10-02,Thor: Ragnarok,7.581,22020
448772,A Great Love,it,Two couples meet at a spa when they realize their respective suites share a bathroom.,1995-01-01,Un grande amore,5.0,5
4232,Scream,en,"A year after the murder of her mother, a teenage girl is terrorized by a masked killer who targets her and her friends by using scary movies as part of a deadly game.",1996-12-20,Scream,7.429,7957
1100988,28 Years Later,en,"Twenty-eight years after the Rage virus outbreak, a heavily-defended island survives connected to the mainland by a single causeway. When one of the group leaves the island into the dark heart of the mainland, he discovers secrets, wonders, and horrors that have mutated not only the infected but other survivors as well.",2025-06-18,28 Years Later,6.6,2559
9806,The Incredibles,en,"Bob Parr has given up his superhero days to log in time as an insurance adjuster and raise his three children with his formerly heroic wife in suburbia. But when he receives a mysterious assignment, it's time to get back into costume.",2004-10-27,The Incredibles,7.725,18890
1175942,The Bad Guys 2,en,"The now-reformed Bad Guys are trying (very, very hard) to be good, but instead find themselves hijacked into a high-stakes, globe-trotting heist, masterminded by a new team of criminals they never saw coming: The Bad Girls.",2025-07-24,The Bad Guys 2,7.656,782
539972,Kraven the Hunter,en,"Kraven Kravinoff's complex relationship with his ruthless gangster father, Nikolai, starts him down a path of vengeance with brutal consequences, motivating him to become not only the greatest hunter in the world, but also one of its most feared.",2024-12-11,Kraven the Hunter,6.4,2337
1339876,Mardaani 3,hi,"Officer Shivani Shivaji Roy returns to hunt down those behind the disappearance of young girls, risking everything to bring them back alive.",2026-01-30,मर्दानी 3,7.422,32
18240,The Proposal,en,"When she learns she's in danger of losing her visa status and being deported, overbearing book editor Margaret Tate forces her put-upon assistant, Andrew Paxton, to marry her.",2009-06-02,The Proposal,7.16,7509
272,Batman Begins,en,"Driven by tragedy, billionaire Bruce Wayne dedicates his life to uncovering and defeating the corruption that plagues his home, Gotham City.  Unable to work within the system, he instead creates a new identity, a symbol of fear for the criminal underworld - The Batman.",2005-06-10,Batman Begins,7.726,22620
329865,Arrival,en,"Taking place after alien crafts land around the world, an expert linguist is recruited by the military to determine whether they come in peace or are a threat.",2016-11-10,Arrival,7.626,19364
11836,The SpongeBob SquarePants Movie,en,"There's trouble brewing in Bikini Bottom. Someone has stolen King Neptune's crown, and it looks like Mr. Krab, SpongeBob's boss, is the culprit. Though he's just been passed over for the promotion of his dreams, SpongeBob stands by his boss, and along with his best pal Patrick, sets out on a treacherous mission to Shell City to reclaim the crown and save Mr. Krab's life.",2004-11-19,The SpongeBob SquarePants Movie,7.087,3198
484503,The Black Pearl,zh,"Women are beaten, raped, tortured and killed in brutal prison.",1982-01-01,黑珍珠,0.0,0
1232221,Mother-in-law in Love With Son-in-law 4,ko,"Joon-yeon and So-hyeon are living together with Joon-yeon's young and pretty mother-in-law for a while after his father-in-law remarries. One day, Joon-yeon is left home alone with his mother-in-law due to So-hyeon and her father-in-law's sudden business trip. The mother-in-law seduces her handsome son-in-law on a hot night. Unable to forget the sex he had with his mother-in-law, Joon-yeon even plans to have a threesome with his wife and his mother-in-law.",2023-12-26,사위 사랑은 장모 4,4.0,1
935505,Female Teacher Punisher: Goddess of Revenge,ja,"In the daytime, an ordinary high school girl's English teacher, but at night, the dynamite body of Super Lady Reiko, who defeats the villains who are infested in the world as an agent of a mysterious organization, explodes.",1990-01-01,女教師仕置人　復讐の女神,0.0,0
346,Seven Samurai,ja,"A samurai answers a village's request for protection after he falls on hard times. The town needs protection from bandits, so the samurai gathers six others to help him teach the people how to defend themselves, and the villagers provide the soldiers with food.",1954-04-26,七人の侍,8.45,4234
106,Predator,en,A team of elite commandos on a secret mission in a Central American jungle come to find themselves hunted by an extraterrestrial warrior.,1987-06-12,Predator,7.555,9119
1480387,undertone,en,The host of a popular paranormal podcast becomes haunted by terrifying recordings mysteriously sent her way.,2026-03-12,undertone,6.218,206
402,Basic Instinct,en,"Catherine, a novelist with an insatiable sexual appetite, becomes a prime suspect when her boyfriend is brutally murdered -- a crime she had described in her latest story.",1992-03-20,Basic Instinct,6.947,4375
868668,Ustaad Bhagat Singh,te,"A tribal boy is shaped by the values of his teacher, who gives him the name 'Bhagat Singh'. He grows up deeply rooted in strong morals, which guide his actions throughout his life.He stands firm against injustice and takes on powerful evil forces, even when facing overwhelming odds.",2026-03-18,ఉస్తాద్ భగత్ సింగ్,6.5,5
242582,Nightcrawler,en,"When Lou Bloom, desperate for work, muscles into the world of L.A. crime journalism, he blurs the line between observer and participant to become the star of his own story. Aiding him in his effort is Nina, a TV-news veteran.",2014-10-23,Nightcrawler,7.708,11727
1308553,Hai Jawani Toh Ishq Hona Hai,hi,"When Jass leaves his marriage over conflicting priorities, a new romance abroad is upended by shocking revelations, forcing him to confront love, loyalty, and the true meaning of commitment.",2026-06-04,है जवानी तो इश्क होना है,0.0,0
111,Scarface,en,"After getting a green card in exchange for assassinating a Cuban government official, Tony Montana stakes a claim on the drug trade in Miami. Viciously murdering anyone who stands in his way, Tony eventually becomes the biggest drug lord in the state, controlling nearly all the cocaine that comes through Miami. But increased pressure from the police, wars with Colombian drug cartels and his own drug-fueled paranoia serve to fuel the flames of his eventual downfall.",1983-12-09,Scarface,8.155,13029
786892,Furiosa: A Mad Max Saga,en,"As the world falls, young Furiosa is snatched from the Green Place of Many Mothers into the hands of a great biker horde led by the warlord Dementus. Sweeping through the wasteland, they encounter the citadel presided over by Immortan Joe. The two tyrants wage war for dominance, and Furiosa must survive many trials as she puts together the means to find her way home.",2024-05-22,Furiosa: A Mad Max Saga,7.454,4876
50619,The Twilight Saga: Breaking Dawn - Part 1,en,Bella Swan and Edward Cullen's honeymoon phase is abruptly disrupted by betrayals and unforeseen tragedies that endanger their world.,2011-11-16,The Twilight Saga: Breaking Dawn - Part 1,6.189,9269
68718,Django Unchained,en,"With the help of a German bounty hunter, a freed slave sets out to rescue his wife from a brutal Mississippi plantation owner.",2012-12-25,Django Unchained,8.192,28044
578,Jaws,en,"When the seaside community of Amity finds itself under attack by a dangerous great white shark, the town's chief of police, a young marine biologist, and a grizzled shark hunter embark on a desperate quest to kill the beast before it strikes again.",1975-06-20,Jaws,7.681,11535
205596,The Imitation Game,en,"Based on the real life story of legendary cryptanalyst Alan Turing, the film portrays the nail-biting race against time by Turing and his brilliant team of code-breakers at Britain's top-secret Government Code and Cypher School at Bletchley Park, during the darkest days of World War II.",2014-11-14,The Imitation Game,7.984,18086
4256,Scary Movie 3,en,"In the third installment of the Scary Movie franchise, news anchorwoman Cindy Campbell has to investigate mysterious crop circles and killing video tapes, and help the President stop an alien invasion in the process.",2003-10-24,Scary Movie 3,5.968,4489
10674,Mulan,en,"When Imperial China calls one man from every family to defend the empire from invading Huns, a young woman disguises herself as a soldier to take her ailing father’s place. Facing ruthless invaders, brutal training, and the risk of execution if discovered, she must decide who she truly is— and what she’s willing to fight for.",1998-06-18,Mulan,7.903,10423
311,Once Upon a Time in America,en,"A former Prohibition-era Jewish gangster returns to the Lower East Side of Manhattan over thirty years later, where he once again must confront the ghosts and regrets of his old life.",1984-05-23,Once Upon a Time in America,8.383,6044
1627824,Rocky's Cat-astrophe,en,"When one of Humdinger's schemes goes awry, a Junkyard Kitten's home is destroyed and Rocky bites off more than he can chew when he invites the kitten to stay at the Lookout overnight. While the kitten causes more trouble than expected, Rocky learns that even heroes need help.",2026-02-27,Rocky's Cat-astrophe,8.0,18
791373,Zack Snyder's Justice League,en,"Determined to ensure Superman's ultimate sacrifice was not in vain, Bruce Wayne aligns forces with Diana Prince with plans to recruit a team of metahumans to protect the world from an approaching threat of catastrophic proportions.",2021-03-18,Zack Snyder's Justice League,8.09,10827
68726,Pacific Rim,en,"Using massive piloted robots to combat the alien threat, earth's survivors take the fight to the invading alien force lurking in the depths of the Pacific Ocean. Nearly defenseless in the face of the relentless enemy, the forces of mankind have no choice but to turn to two unlikely heroes who now stand as earth's final hope against the mounting apocalypse.",2013-07-11,Pacific Rim,6.927,13385
858024,Hamnet,en,"The powerful story of love and loss that inspired the creation of Shakespeare's timeless masterpiece, Hamlet.",2025-11-26,Hamnet,7.749,1362
670,Oldboy,ko,"With no clue how he came to be imprisoned, drugged and tortured for 15 years, a desperate man seeks revenge on his captors.",2003-11-21,올드보이,8.2,9864
293167,Kong: Skull Island,en,"Explore the mysterious and dangerous home of the king of the apes as a team of explorers ventures deep inside the treacherous, primordial island.",2017-03-08,Kong: Skull Island,6.553,11131
6977,No Country for Old Men,en,"Llewelyn Moss stumbles upon dead bodies, $2 million and a hoard of heroin in a Texas desert, but methodical killer Anton Chigurh comes looking for it, with local sheriff Ed Tom Bell hot on his trail. The roles of prey and predator blur as the violent pursuit of money and justice collide.",2007-11-09,No Country for Old Men,7.95,13330
588228,The Tomorrow War,en,"The world is stunned when a group of time travelers arrive from the year 2051 to deliver an urgent message: Thirty years in the future, mankind is losing a global war against a deadly alien species. The only hope for survival is for soldiers and civilians from the present to be transported to the future and join the fight. Among those recruited is high school teacher and family man Dan Forester. Determined to save the world for his young daughter, Dan teams up with a brilliant scientist and his estranged father in a desperate quest to rewrite the fate of the planet.",2021-09-03,The Tomorrow War,7.484,4153
1448560,Wildcat,en,An ex-black ops team reunite to pull off a desperate heist in order to save the life of their leader’s eight-year-old daughter.,2025-11-19,Wildcat,6.2,171
1561144,Madhuvidhu,ml,"When Amrutharaj, a groom from an all-male household repeatedly rejected by brides' families, falls in love with Sneha Marcose, their journey toward marriage ignites a chain of hilarious chaos inside his unruly home.",2026-04-23,മധുവിധു,6.3,3
1108211,Lost in the Stars,zh,"He Fei's wife, Li Muzi, disappears during their anniversary trip. When she reappears, he insists that she is not his wife. As Chen Mai, a top lawyer gets involved in this bizarre case, more mysteries start to emerge.",2023-06-22,消失的她,6.569,101
1290417,Thrash,en,"When a Category 5 hurricane decimates a coastal town, the storm surge brings devastation, chaos, and something far more frightening onto shore: hungry sharks.",2026-04-10,Thrash,6.036,616
1359,American Psycho,en,"A wealthy New York investment banking executive hides his alternate psychopathic ego from his co-workers and friends as he escalates deeper into his illogical, gratuitous fantasies.",2000-04-13,American Psycho,7.4,12294
615453,Ne Zha,zh,"A young boy is born as the reincarnation of a demonic power, into a society that hates and fears him. Destined by prophecy to bring destruction to the world, Nezha must choose between good and evil to see if he can change his fate.",2019-07-26,哪吒之魔童降世,7.908,865
411,"The Chronicles of Narnia: The Lion, the Witch and the Wardrobe",en,"Siblings Lucy, Edmund, Susan and Peter step through a magical wardrobe and find the land of Narnia. There, they discover a charming, once peaceful kingdom that has been plunged into eternal winter by the evil White Witch, Jadis. Aided by the wise and magnificent lion, Aslan, the children lead Narnia into a spectacular, climactic battle to be free of the Witch's glacial powers forever.",2005-12-07,"The Chronicles of Narnia: The Lion, the Witch and the Wardrobe",7.137,11491
10195,Thor,en,"Against his father Odin's will, The Mighty Thor - a powerful but arrogant warrior god - recklessly reignites an ancient war. Thor is cast down to Earth and forced to live among humans as punishment. Once here, Thor learns what it takes to be a true hero when the most dangerous villain of his world sends the darkest forces of Asgard to invade Earth.",2011-04-21,Thor,6.77,22346
10020,Beauty and the Beast,en,"Follow the adventures of Belle, a bright young woman who finds herself in the castle of a prince who's been turned into a mysterious beast. With the help of the castle's enchanted staff, Belle soon learns the most important lesson of all -- that true beauty comes from within.",1991-10-22,Beauty and the Beast,7.728,10669
10591,The Girl Next Door,en,"Exceptionally ambitious high schooler Matthew has aspirations for a career in politics when he falls in love with his gorgeous 19-year-old neighbor, Danielle. But Matthew's bright future is jeopardized when he finds Danielle was once a porn star. As Danielle's past catches up with her, Matthew's love for her forces him to re-evaluate his goals.",2004-04-09,The Girl Next Door,6.745,4018
7131,Van Helsing,en,Famed monster slayer Gabriel Van Helsing is dispatched to Transylvania to assist the last of the Valerious bloodline in defeating Count Dracula. Anna Valerious reveals that Dracula has formed an unholy alliance with Dr. Frankenstein's monster and is hell-bent on exacting a centuries-old curse on her family.,2004-05-03,Van Helsing,6.415,6659
781732,Animal,hi,The hardened son of a powerful industrialist returns home after years abroad and vows to take bloody revenge on those threatening his father's life.,2023-12-01,Animal,6.119,189
744,Top Gun,en,"For Lieutenant Pete 'Maverick' Mitchell and his friend and co-pilot Nick 'Goose' Bradshaw, being accepted into an elite training school for fighter pilots is a dream come true. But a tragedy, as well as personal demons, will threaten Pete's dreams of becoming an ace pilot.",1986-05-16,Top Gun,7.067,9570
5879,In the Realm of the Senses,ja,"A passionate telling of the story of Sada Abe, a woman whose affair with her master led to an obsessive and ultimately destructive sexual relationship.",1976-09-15,愛のコリーダ,6.593,733
940551,Migration,en,"After a migrating duck family alights on their pond with thrilling tales of far-flung places, the Mallard family embarks on a family road trip, from New England, to New York City, to tropical Jamaica.",2023-12-06,Migration,7.355,2247
18334,Guinea Pig: Devil's Experiment,ja,Masked thugs torture an innocent woman in increasingly brutal ways.,1985-09-04,ギニーピッグ 悪魔の実験,4.784,160
36557,Casino Royale,en,"Le Chiffre, a banker to the world's terrorists, is scheduled to participate in a high-stakes poker game in Montenegro, where he intends to use his winnings to establish his financial grip on the terrorist market. M sends Bond—on his maiden mission as a 00 Agent—to attend this game and prevent Le Chiffre from winning. With the help of Vesper Lynd and Felix Leiter, Bond enters the most important poker game in his already dangerous career.",2006-11-14,Casino Royale,7.57,11687
8355,Ice Age: Dawn of the Dinosaurs,en,"Times are changing for Manny the moody mammoth, Sid the motor mouthed sloth and Diego the crafty saber-toothed tiger. Life heats up for our heroes when they meet some new and none-too-friendly neighbors – the mighty dinosaurs.",2009-06-26,Ice Age: Dawn of the Dinosaurs,6.767,8866
1119878,Ice Road: Vengeance,en,"Big rig ice road driver Mike McCann travels to Nepal to scatter his late brother’s ashes on Mt. Everest. While on a packed tour bus traversing the deadly 12,000 ft. terrain of the infamous Road to the Sky, McCann and his mountain guide encounter a group of mercenaries and must fight to save themselves, the busload of innocent travelers, and the local villagers’ homeland.",2025-06-27,Ice Road: Vengeance,6.242,630
44896,Rango,en,"When Rango, a lost family pet, accidentally winds up in the gritty, gun-slinging Western town of Dirt, the theater-loving lizard suddenly finds himself the newly appointed sheriff. Welcomed as the last hope the town has been waiting for, Rango is forced to play his new role to the hilt and uncover the truth behind a looming water crisis—before his act catches up with him.",2011-03-02,Rango,6.899,7107
259693,The Conjuring 2,en,Lorraine and Ed Warren travel to north London to help a single mother raising four children alone in a house plagued by malicious spirits.,2016-06-08,The Conjuring 2,7.3,9179
1621,Trading Places,en,A snobbish investor and a wily street con-artist find their positions reversed as part of a bet by two callous millionaires.,1983-06-07,Trading Places,7.228,3660
411088,The Invisible Guest,es,"Barcelona, Spain. Adrián Doria, a young and successful businessman accused of murder, meets one night with Virginia Goodman, an expert interrogation lawyer, in order to devise a defense strategy.",2017-01-06,Contratiempo,8.078,4986
49013,Cars 2,en,Star race car Lightning McQueen and his pal Mater head overseas to compete in the World Grand Prix race. But the road to the championship becomes rocky as Mater gets caught up in an intriguing adventure of his own: international espionage.,2011-06-11,Cars 2,6.18,8473
255709,Hope,ko,"After 8-year-old So-won narrowly survives a brutal sexual assault, her family labors to help her heal while coping with their own rage and grief.",2013-10-02,소원,8.401,857
4258,Scary Movie 5,en,"Home with their newly-formed family, happy parents Dan and Jody are haunted by sinister, paranormal activities. Determined to expel the insidious force, they install security cameras and discover their family is being stalked by an evil dead demon.",2013-04-11,Scary Movie 5,4.791,3031
4951,10 Things I Hate About You,en,"On the first day at his new school, Cameron instantly falls for Bianca, the gorgeous girl of his dreams. The only problem is that Bianca is forbidden to date until her ill-tempered, completely un-dateable older sister Kat goes out, too. In an attempt to solve his problem, Cameron singles out the only guy who could possibly be a match for Kat: a mysterious bad boy with a nasty reputation of his own.",1999-03-30,10 Things I Hate About You,7.594,8917
